{
  "$schema": "https://vomaste.cz/schemas/canonical/tooling-command.schema.json",
  "schemaVersion": 1,
  "@context": "https://vomaste.cz/context/v1.jsonld",
  "@id": "https://vomaste.cz/id/prikazy/data-validate",
  "@type": "vomaste:ToolingCommand",
  "recordType": "toolingCommand",
  "identifier": "data-validate",
  "kind": "npm",
  "name": "data:validate",
  "title": "Kanonická brána datasetu",
  "category": "validace",
  "summary": "Zvaliduje tvar všech kanonických souborů proti schemas/canonical/ (AJV 2020-12, strict), pak nad celým datasetem referenční integritu, sémantiku a JSON-LD expanzi. S `-- --file <cesta>` zkontroluje TVAR jednoho záznamu — rychlá smyčka při editaci; referenční a sémantická pravidla v tomhle režimu záměrně neběží a skript to říká.",
  "enforces": [
    "Kanonický soubor, který neodpovídá schématu podle svého recordType (včetně pole navíc — schémata mají additionalProperties: false).",
    "R1–R8: unikátnost @id, unikátnost identifieru v dossieru, soulad cesty souboru s @id, existence cílů všech referencí uvnitř téhož dossieru, existence entit vztahů, ≥1 existující zdroj u tvrzení mimo status-opinion, integrita kurátorované grafové vrstvy, obousměrnost vazby claim↔source.",
    "S1–S10: doložení tvrzení (single/corroborated přes nezávislé rodiny zdrojů), autorizační pravidla S5/S6, subjektové uzly grafu S7, souvislost grafu S8, a S10 — týž vydavatel nikdy nezakládá nezávislé doložení.",
    "T1–T8: parita ručně psané tabulky „Registr tvrzení“ s kanonickými claim záznamy (kotvy, 1:1 množiny, byte-verná shoda textu/statusu/zdrojů, uzavřený slovník statusů, dedup URL u corroborated, plnostránková doktrína zdroje).",
    "Neplatná JSON-LD expanze datasetu."
  ],
  "whenToRun": "Po každé editaci čehokoli pod data/dossiers/**. Je to první krok všech tří režimů pipeline (build, dev, check) — nevalidní data musí zastavit běh dřív, než cokoli vygeneruje.",
  "inputs": [
    "data/dossiers/**/*.json",
    "data/dossiers/_shared/entities/*.json",
    "data/dossiers/_shared/vocabularies/*.json",
    "schemas/canonical/*.schema.json"
  ],
  "rules": [
    "R1",
    "R2",
    "R3",
    "R4",
    "R5",
    "R6",
    "R7",
    "R8",
    "S1",
    "S2",
    "S3",
    "S4",
    "S5",
    "S6",
    "S7",
    "S8",
    "S9",
    "S10",
    "T1",
    "T2",
    "T3",
    "T4",
    "T5",
    "T6",
    "T7",
    "T8"
  ],
  "sourceFile": "scripts/data/validate.mjs",
  "describedFrom": "header",
  "notes": [
    "Prázdný dataset (0 dossier balíčků) je legitimní stav a projde s explicitní hláškou — brána existuje dřív než data."
  ]
}
