{
  "$schema": "https://vomaste.cz/schemas/canonical/tooling-command.schema.json",
  "schemaVersion": 1,
  "@context": "https://vomaste.cz/context/v1.jsonld",
  "@id": "https://vomaste.cz/id/prikazy/js-build",
  "@type": "vomaste:ToolingCommand",
  "recordType": "toolingCommand",
  "identifier": "js-build",
  "kind": "npm",
  "name": "js:build",
  "title": "Build JavaScriptu",
  "category": "generovani",
  "summary": "Zabalí esbuildem assets/js/app.js a assets/js/graph-app.js do minifikovaných bundlů pro ES2020 v static/js/.",
  "whenToRun": "V build, dev i generate:all. Ručně po změně čehokoli pod assets/js/.",
  "inputs": [
    "assets/js/app.js",
    "assets/js/graph-app.js",
    "assets/js/modules/**"
  ],
  "outputs": [
    "static/js/app.js",
    "static/js/graph-app.js (obojí gitignorováno)"
  ],
  "describedFrom": "command"
}
