{
  "$schema": "https://vomaste.cz/schemas/canonical/tooling-command.schema.json",
  "schemaVersion": 1,
  "@context": "https://vomaste.cz/context/v1.jsonld",
  "@id": "https://vomaste.cz/id/prikazy/verify-full-pages",
  "@type": "vomaste:ToolingCommand",
  "recordType": "toolingCommand",
  "identifier": "verify-full-pages",
  "kind": "npm",
  "name": "verify:full-pages",
  "title": "Plnostránková doktrína",
  "category": "kontrola",
  "summary": "Vynucuje, že každé tvrzení a každý zdroj je plnohodnotná stránka, ne stub — a že se vykresluje ze strukturovaných dat, ne z druhé ručně psané reprezentace. Doktrína je závazná i pro adoptery a forky.",
  "enforces": [
    "Stránka tvrzení bez sekce citovaných zdrojů (id=\"clm-sources-h\") nebo bez odkazu na Git provenance.",
    "Stránka zdroje bez metadatové tabulky (řádek „Odkaz“), bez sekce podporovaných tvrzení (id=\"src-claims-h\") — s výjimkou záměrně kontextových zdrojů bez tvrzení — nebo bez odkazu na Git provenance."
  ],
  "whenToRun": "Až po zola build.",
  "inputs": [
    "public/dossiers/**/index.html"
  ],
  "sourceFile": "scripts/dossier/verify-full-pages.mjs",
  "describedFrom": "header",
  "notes": [
    "Zdrojová strana téže doktríny (povinná pole a minimální redakční tělo zdroje) žije v kanonických validátorech, JSON-LD strana ve verify:jsonld."
  ]
}
