{
  "$schema": "https://vomaste.cz/schemas/canonical/tooling-command.schema.json",
  "schemaVersion": 1,
  "@context": "https://vomaste.cz/context/v1.jsonld",
  "@id": "https://vomaste.cz/id/prikazy/skill-schema-change",
  "@type": "vomaste:ToolingCommand",
  "recordType": "toolingCommand",
  "identifier": "skill-schema-change",
  "kind": "skill",
  "name": "schema-change",
  "title": "Změna datového kontraktu",
  "category": "provoz",
  "personas": [
    "developer",
    "maintainer"
  ],
  "riskLevel": "maintainer",
  "writes": true,
  "summary": "Provede změnu kanonického schématu se všemi třinácti místy, která z ní plynou: schéma, existující data, view modely, šablony, exporty, JSON-LD kontext, validátory, testy, golden snapshot, migrace, datový kontrakt, vzdělávací vrstva a SEO konfigurace. U každého řádku vyžaduje buď „hotovo“, nebo explicitní „netýká se, protože“.",
  "whenToRun": "Při přidání, přejmenování nebo odebrání pole v typu záznamu, a při změně enumu, povinnosti nebo formátu.",
  "outputs": [
    "schemas/canonical/**",
    "scripts/data/build-view-models.mjs",
    "templates/**",
    "migrace"
  ],
  "describedFrom": "header",
  "notes": [
    "Poloviční implementace pole je selhání, ne rozpracovanost — a brána ho nemusí odhalit v obou směrech.",
    "Nejpodceňovanější kroky jsou existující data a migrace. Povinné pole bez migrace shodí build na každém existujícím záznamu, což je správně, ale musí to být plán, ne překvapení.",
    "Nejlevnější pole je to, které nevzniklo. Hloubka v grafu se počítá, ne ukládá — a to je vzor, ne výjimka.",
    "Skóre důvěryhodnosti jako pole skill odmítá: hodnotilo by pravdu, ne doloženost, a truth-rating značky verify:jsonld zakazuje."
  ]
}
