{
  "$schema": "https://vomaste.cz/schemas/canonical/tooling-command.schema.json",
  "schemaVersion": 1,
  "@context": "https://vomaste.cz/context/v1.jsonld",
  "@id": "https://vomaste.cz/id/prikazy/workflow-change-a-schema",
  "@type": "vomaste:ToolingCommand",
  "recordType": "toolingCommand",
  "identifier": "workflow-change-a-schema",
  "kind": "workflow",
  "name": "change-a-schema",
  "title": "Změna datového kontraktu",
  "category": "provoz",
  "personas": [
    "maintainer",
    "developer"
  ],
  "riskLevel": "maintainer",
  "writes": true,
  "summary": "Nejrizikovější běžná změna v repozitáři, vedená tak, aby po ní nezůstalo poloviční pole: co dnes platí podle schématu, třináct míst fan-outu s explicitním „netýká se, protože“, migrace u povinného pole, testy a golden snapshot, dopad na dokumentaci, ADR u sporného rozhodnutí a plná brána.",
  "whenToRun": "Při přidání, přejmenování nebo odebrání pole. Nezačíná se bez jasna v tom, kdo pole bude číst.",
  "describedFrom": "header",
  "notes": [
    "Nejlevnější pole je to, které nevzniklo. Hloubka v grafu se počítá, ne ukládá — a to je vzor.",
    "Povinné pole bez migrace shodí build na každém existujícím záznamu. Doplnit ho odhadem je horší než nechat pole volitelné.",
    "additionalProperties: false je brána, ne překážka. Šablona čtoucí pole, které schéma nezná, znamená postup shora dolů."
  ]
}
